{
  "schema_version": "linkerforge.openmm-production-preflight.v1",
  "status": "pass",
  "run_authorized": true,
  "inputs": {
    "production_config": "M:\\ChatGPT\\LinkerForge 2\\configs\\openmm-publication-protocol-v2-storage-aware.json",
    "production_config_sha256": "73f224f675259408436cb5c324df1914f3982d8df823d32da9065db2dd78803a",
    "smoke_manifest": "M:\\ChatGPT\\LinkerForge 2\\runs\\openmm\\acceptance-1ubq-gs10-2gb1-smoke\\run_manifest.json",
    "smoke_manifest_sha256": "be85b1d93c183805da116d4908d5b3b7a4595514f8ecfe01ae552a865f41a1c0",
    "smoke_run_directory": "M:\\ChatGPT\\LinkerForge 2\\runs\\openmm\\acceptance-1ubq-gs10-2gb1-smoke",
    "target_parent": "M:\\ChatGPT\\LinkerForge 2\\runs\\openmm"
  },
  "observations": {
    "smoke_atom_count": 36751,
    "smoke_replicates": 3,
    "smoke_production_steps_total": 75000,
    "smoke_production_seconds_total": 112.103,
    "smoke_trajectory_frames_total": 75,
    "smoke_trajectory_bytes_total": 33082728,
    "observed_bytes_per_frame": 441103.04,
    "observed_seconds_per_step": 0.001494709
  },
  "projection": {
    "replicates": 3,
    "production_nanoseconds_per_replicate": 50.0,
    "trajectory_frames_total": 3000,
    "trajectory_report_interval_steps": 25000,
    "structural_metric_frames_total": 15000,
    "structural_metric_report_interval_steps": 5000,
    "trajectory_bytes": 1323309120,
    "trajectory_gib": 1.232,
    "runtime_seconds": 114345.252,
    "runtime_hours": 31.76
  },
  "storage_gate": {
    "free_bytes": 11322736640,
    "free_gib": 10.545,
    "trajectory_storage_multiplier": 1.5,
    "fixed_reserve_gib": 5.0,
    "required_free_bytes": 7353672800,
    "required_free_gib": 6.849,
    "shortfall_bytes": 0,
    "shortfall_gib": 0.0
  },
  "claim_boundary": "This preflight estimates operations from one completed same-construct smoke run. It is not evidence of trajectory convergence, stability, or biological function."
}
